{
  "id": "f1e2d3c4-b5a6-4978-9012-345678901234",
  "name": "acme-corp",
  "display_name": "Acme Corporation",
  "description": "Enterprise identity management organization",
  "visibility": "PUBLIC",
  "owner_id": "user-admin-001",
  "join_code": "ACME2026",
  "status": "active",
  "org_type": "enterprise",
  "join_mechanism": "code",
  "requires_approval": false,
  "is_discoverable": true,
  "created_at": "2026-01-01T00:00:00Z",
  "updated_at": "2026-03-15T14:00:00Z"
}
